{
  "schema_version": 1,
  "task_id": "X6-002-PLUGGABLE-NODE-VIEWS",
  "title": "Pluggable X6 node views and package responsibility refactor",
  "status": "completed",
  "owner": "codex",
  "revision": 6,
  "updated_at": "2026-07-29T18:01:00-03:00",
  "objective": "Make the Ant Design card the complete rendered X6 node, introduce a vendor-neutral node-view discriminator and internal renderer catalog for future shapes, reorganize x6-canvas by responsibility, and consolidate behavioral tests and API snapshots under one tests root.",
  "affected_paths": [
    ".ai/state/tasks/X6-002-PLUGGABLE-NODE-VIEWS.json",
    "CURRENT_PLANNING_STATE.md",
    "apps/architecture-studio/src/presentation.ts",
    "apps/architecture-studio/test/presentation.test.mjs",
    "docs/specs/architecture-studio-read-only-v1.md",
    "docs/generated/artifact-manifest.json",
    "docs/generated/grafting.graph.json",
    "docs/generated/project-graph.json",
    "docs/generated/repo-map.md",
    "packages/ui/AGENTS.md",
    "packages/ui/DECISIONS.md",
    "packages/ui/README.md",
    "packages/ui/project.json",
    "packages/ui/src/index.ts",
    "packages/ui/src/molecules/entity-summary.tsx",
    "packages/ui/test/ui.test.mjs",
    "packages/ui/tests/ui.test.mjs",
    "packages/ui/tests/snapshots/public-api.md",
    "packages/x6-canvas/AGENTS.md",
    "packages/x6-canvas/README.md",
    "packages/x6-canvas/package.json",
    "packages/x6-canvas/project.json",
    "packages/x6-canvas/src/index.ts",
    "packages/x6-canvas/src/contracts/canvas.ts",
    "packages/x6-canvas/src/canvas/controller.ts",
    "packages/x6-canvas/src/canvas/create-read-only-canvas.ts",
    "packages/x6-canvas/src/canvas/handle.ts",
    "packages/x6-canvas/src/canvas/interaction-options.ts",
    "packages/x6-canvas/src/edges/metadata.ts",
    "packages/x6-canvas/src/edges/selection.ts",
    "packages/x6-canvas/src/edges/themes.ts",
    "packages/x6-canvas/src/internal/react-node-registry.ts",
    "packages/x6-canvas/src/internal/react-node.tsx",
    "packages/x6-canvas/src/internal/read-only-canvas.ts",
    "packages/x6-canvas/src/internal/visual-style.ts",
    "packages/x6-canvas/src/nodes/catalog.ts",
    "packages/x6-canvas/src/nodes/contracts.ts",
    "packages/x6-canvas/src/nodes/metadata.ts",
    "packages/x6-canvas/src/nodes/ports.ts",
    "packages/x6-canvas/src/nodes/registry.ts",
    "packages/x6-canvas/src/nodes/selection.ts",
    "packages/x6-canvas/src/nodes/card/component.tsx",
    "packages/x6-canvas/src/nodes/card/data.ts",
    "packages/x6-canvas/src/nodes/card/definition.ts",
    "packages/x6-canvas/test/react-node.test.mjs",
    "packages/x6-canvas/test/read-only-canvas.test.mjs",
    "packages/x6-canvas/test/visual-style.test.mjs",
    "packages/x6-canvas/tests/card-node.test.mjs",
    "packages/x6-canvas/tests/node-metadata.test.mjs",
    "packages/x6-canvas/tests/read-only-canvas.test.mjs",
    "packages/x6-canvas/tests/snapshots/public-api.md"
  ],
  "blockers": [],
  "validations": [
    "pnpm.cmd --filter @grafting/ui check/test: passed with 5/5 component contracts",
    "pnpm.cmd exec nx run ui:api-check --skip-nx-cache: intentional baseline update reviewed, then normal check passed with no AntD type leak",
    "pnpm.cmd --filter @grafting/x6-canvas check/test: passed with 12/12 canvas, card-root, catalog, selection, interaction, edge, and lifecycle contracts",
    "pnpm.cmd exec nx run x6-canvas:api-check --skip-nx-cache: intentional baseline update reviewed, then normal check passed with no X6, React-shape, or AntD type leak",
    "Card SSR contracts prove the ant-card element is the component root, owns the full height, accent, and selection border, and has no decorative wrapper",
    "Catalog contracts prove card resolution is vendor-runtime-free, unknown views fail explicitly, and view definitions own component, data, size, and ports",
    "pnpm.cmd --filter @grafting/architecture-studio check/test/build: passed with 5/5 tests and view card selected from the single PROJECTION configuration",
    "Architecture Studio production build passed (2596 modules; JS 1186.53 kB raw / 352.80 kB gzip; separate Worker and Wasm asset)",
    "pnpm.cmd docs:check: repository map, artifact manifest, Graph IR, Rust API, and TypeScript API drift checks passed (49 nodes, 48 edges)",
    "pnpm.cmd audit --prod: no known vulnerabilities found",
    ".venv\\Scripts\\python.exe -m automation.coordination --root .: passed with 24 task records, including completed X6-002",
    "git diff --check: passed"
  ],
  "artifacts": [
    "packages/x6-canvas/src/canvas/",
    "packages/x6-canvas/src/contracts/canvas.ts",
    "packages/x6-canvas/src/edges/",
    "packages/x6-canvas/src/nodes/",
    "packages/x6-canvas/tests/",
    "packages/ui/src/molecules/entity-summary.tsx",
    "packages/ui/tests/",
    "apps/architecture-studio/src/presentation.ts",
    "docs/specs/architecture-studio-read-only-v1.md"
  ],
  "risks": [
    "A public node-view key must remain presentation-only and must not become a TypeScript graph classification or layout rule.",
    "Adding generic extension hooks too early could leak React or X6 types; the initial extension point remains an internal catalog selected by a Grafting-owned string union.",
    "Moving tests must update native scripts and Nx inputs atomically so evidence is not silently skipped.",
    "The AntD public entry point still produces a large initial Studio bundle; component-level entry points or code splitting remain a separate performance task."
  ],
  "next_responsible_party": "repository-owner"
}
