{
  "schema_version": 1,
  "task_id": "I-006B-ARCH-STUDIO-REAL-GRAPH-CUTOVER",
  "title": "Architecture Studio real Graph IR cutover and selection inspector",
  "status": "blocked",
  "owner": "codex",
  "revision": 21,
  "updated_at": "2026-07-29T18:38:03Z",
  "objective": "Atomically move Architecture Studio from the frozen Graph IR spike and transitional graph-x6 package to the real Graph IR v1 artifact and direct @grafting/x6-canvas composition, then use vendor-neutral activation and visual roles for synchronized accessible selection, provenance inspection, and a polished read-only canvas.",
  "affected_paths": [
    ".ai/state/tasks/I-006B-ARCH-STUDIO-REAL-GRAPH-CUTOVER.json",
    "apps/architecture-studio/AGENTS.md",
    "apps/architecture-studio/README.md",
    "apps/architecture-studio/index.html",
    "apps/architecture-studio/package.json",
    "apps/architecture-studio/project.json",
    "apps/architecture-studio/src/main.ts",
    "apps/architecture-studio/src/layout-client.ts",
    "apps/architecture-studio/src/layout.worker.ts",
    "apps/architecture-studio/src/presentation.ts",
    "apps/architecture-studio/src/style.css",
    "apps/architecture-studio/test/presentation.test.mjs",
    "packages/graph-x6/AGENTS.md",
    "packages/graph-x6/README.md",
    "packages/graph-x6/package.json",
    "packages/graph-x6/project.json",
    "packages/graph-x6/src/index.ts",
    "packages/graph-x6/src/model.ts",
    "packages/graph-x6/test/model.test.mjs",
    "packages/graph-x6/tsconfig.json",
    "packages/isekai-wasm/README.md",
    "packages/x6-canvas/README.md",
    "packages/x6-canvas/src/index.ts",
    "packages/x6-canvas/src/internal/read-only-canvas.ts",
    "packages/x6-canvas/src/internal/visual-style.ts",
    "packages/x6-canvas/test/read-only-canvas.test.mjs",
    "packages/x6-canvas/test/visual-style.test.mjs",
    "packages/x6-canvas/tests/snapshots/public-api.md",
    "pnpm-lock.yaml",
    "docs/generated/project-graph.json",
    "docs/generated/repo-map.md",
    "docs/generated/artifact-manifest.json",
    "docs/generated/grafting.graph.json",
    "tools/scripts/graph-ir-extract.mjs",
    "tools/scripts/graph-ir-extract.test.mjs",
    "Cargo.lock",
    "CURRENT_PLANNING_STATE.md",
    "docs/specs/architecture-studio-read-only-v1.md",
    "libs/graph/core/README.md",
    "libs/graph/core/project.json",
    "libs/graph/core/src/layout.rs",
    "libs/graph/core/src/lib.rs",
    "libs/graph/core/tests/public_api_contract.rs",
    "libs/graph/core/tests/snapshots/public-api.txt",
    "libs/isekai/wasm-bridge/Cargo.toml",
    "libs/isekai/wasm-bridge/README.md",
    "libs/isekai/wasm-bridge/project.json",
    "libs/isekai/wasm-bridge/src/graph_layout.rs",
    "libs/isekai/wasm-bridge/src/handle.rs",
    "libs/isekai/wasm-bridge/src/lib.rs"
  ],
  "blockers": [
    "Owner browser acceptance found that the SVG-only X6 label still escapes or clips its visual card. The owner chose to establish a reusable React UI package with bespoke components before a separately claimed React-node integration resumes this visual acceptance item."
  ],
  "validations": [
    "pnpm.cmd --filter @grafting/architecture-studio check/test: passed (5 presentation and boundary tests)",
    "pnpm.cmd --filter @grafting/x6-canvas check/test: passed (6 immutable-handle/activation tests and 4 private visual/selection/interaction tests)",
    "pnpm.cmd exec nx run x6-canvas:api-check: updated baseline reviewed, then normal check passed with generic visual roles and no @antv/x6 public leak",
    "pnpm.cmd --filter @grafting/architecture-studio build: passed after the flat text clipping and readable card sizing correction (981 modules; separate layout Worker; 196.01 kB Wasm asset; JS 644.63 kB raw / 176.06 kB gzip)",
    "cargo test -p grafting-graph-core --all-features: passed (5 unit tests plus Graph IR CLI and public contract suites)",
    "cargo clippy for graph-core and isekai-wasm with --no-deps and -D warnings: passed; the pre-existing wasm handle len_without_is_empty lint was explicitly allowed",
    "cargo test -p grafting-isekai-wasm: 6/6 native tests passed, including graph layout",
    "wasm-pack test --node libs/isekai/wasm-bridge: 7/7 WebAssembly tests passed, including graph layout",
    "node --test tools/scripts/graph-ir-extract.test.mjs: 7/7 passed, including the Git porcelain regression and direct architecture-studio to x6-canvas cutover",
    "pnpm.cmd run graph:v1:check: JSON Schema and Rust structural validation passed",
    "pnpm.cmd run docs:check: repo map, artifact manifest, Graph IR, Rust API, and TypeScript API drift checks passed",
    ".venv\\Scripts\\python.exe -m automation.coordination --root .: passed with 22 task records",
    "git diff --check on the full declared scope: passed",
    "Owner-reported SVG mismatch was traced to X6 highlighting the full node view; selection now targets the visible body, while title and caption use one calculated bounded text area with ellipsis",
    "After owner retest, ordinary left-drag panning was restored; nodes now carry a native selection outline, activation reaches the consumer even if private highlighting fails, and list rendering completes before external canvas selection",
    "The running Architecture Studio dev server returned HTTP 200 and served the current ordinary-left-pan configuration and native selectionOutline implementation",
    "Owner retest rejected the nested SVG text viewport because its independent coordinate system reduced and cropped labels; title and caption now remain in the card coordinate system, share a user-space clipPath, use 15/14 px title and 10 px caption fonts, and receive 222 px of text width from the single 288 px application node size",
    "Architecture Studio dev server returned HTTP 200 for the shell, app projection, and compiled x6-canvas visual-style module; served code contains vertical/horizontal smooth connectors, shadows, and target markers",
    "Architecture Studio dev server returned HTTP 200 after the correction and served the flat clipPath, readable font sizes, no textViewport, and the centralized 288 px node width",
    "In-app Browser was requested for final visual QA; the host returned no available iab backend, so owner browser acceptance remains required"
  ],
  "artifacts": [
    "apps/architecture-studio/src/main.ts",
    "apps/architecture-studio/src/layout-client.ts",
    "apps/architecture-studio/src/layout.worker.ts",
    "apps/architecture-studio/src/presentation.ts",
    "apps/architecture-studio/src/style.css",
    "apps/architecture-studio/test/presentation.test.mjs",
    "packages/x6-canvas/src/internal/read-only-canvas.ts",
    "packages/x6-canvas/src/internal/visual-style.ts",
    "packages/x6-canvas/test/read-only-canvas.test.mjs",
    "packages/x6-canvas/test/visual-style.test.mjs",
    "packages/x6-canvas/tests/snapshots/public-api.md",
    "packages/graph-x6/ (removed)",
    "docs/generated/project-graph.json",
    "docs/generated/repo-map.md",
    "docs/generated/grafting.graph.json",
    "tools/scripts/graph-ir-extract.mjs",
    "tools/scripts/graph-ir-extract.test.mjs",
    "libs/graph/core/src/layout.rs",
    "libs/graph/core/tests/snapshots/public-api.txt",
    "libs/isekai/wasm-bridge/src/graph_layout.rs"
  ],
  "risks": [
    "The in-app browser host currently registers no browser backend, so repository work cannot repair or substitute that external capability.",
    "Removing graph-x6 must happen in the same validated change that moves its only presentation mapping into Architecture Studio.",
    "Application presentation may place entities deterministically but must not duplicate graph-aware query, ordering, adjacency, validation, or layout behavior owned by Rust.",
    "The initial Inspector must remain honest about unknown freshness and must not claim that the later Rust query/filter boundary is complete.",
    "The cutover exposed a pre-existing first-line Git porcelain parsing defect in the Graph IR extractor; the same task now owns the minimal trimEnd fix and a regression test because regeneration cannot complete otherwise.",
    "Owner browser feedback confirmed the fixed four-column placement is readable but visually unstructured; the resumed scope adds one grouped-grid Rust heuristic, a batched Wasm Worker boundary, and a single application projection configuration instead of adding layout logic to TypeScript.",
    "The pinned formatter expands one pre-existing handle.rs expression even when checking the graph-core package; the mechanical formatting-only change is included so the required format validation can pass.",
    "Owner clarified that Miro-like visual polish, not only coordinate calculation, is required for acceptance; the resumed task adds generic visual roles and private X6 styling without enabling mutation or leaking vendor types."
  ],
  "next_responsible_party": "codex"
}
