{
  "schema_version": 1,
  "task_id": "X6-004-MOVABLE-CARD-NODES",
  "title": "Movable Ant Design card nodes in Architecture Studio",
  "status": "completed",
  "owner": "codex",
  "revision": 4,
  "updated_at": "2026-07-29T19:47:34-03:00",
  "objective": "Expose a vendor-neutral, opt-in node movement policy from @grafting/x6-canvas and enable it for Architecture Studio's existing @grafting/ui EntitySummary Ant Design Card nodes while keeping Graph IR, caller-owned coordinates, connections, edges, labels, and other graph structure read-only.",
  "affected_paths": [
    ".ai/state/tasks/X6-004-MOVABLE-CARD-NODES.json",
    "packages/x6-canvas/src/index.ts",
    "packages/x6-canvas/src/canvas/interaction-options.ts",
    "packages/x6-canvas/tests/composition.test.mjs",
    "packages/x6-canvas/tests/snapshots/public-api.md",
    "packages/x6-canvas/README.md",
    "apps/architecture-studio/src/canvas-composition.ts",
    "apps/architecture-studio/src/style.css",
    "apps/architecture-studio/test/canvas-composition.test.mjs",
    "apps/architecture-studio/README.md",
    "docs/specs/architecture-studio-read-only-v1.md",
    "docs/generated/artifact-manifest.json",
    "docs/generated/grafting.graph.json",
    "docs/generated/grafting.graph.spike.json"
  ],
  "blockers": [],
  "validations": [
    "pnpm.cmd --filter @grafting/x6-canvas check passed",
    "pnpm.cmd --filter @grafting/x6-canvas test passed: 11 behavioral tests, including opt-in node movement with every structural X6 editing capability disabled",
    "the intentional x6-canvas TypeScript public-API baseline update was reviewed and the normal api-check passed with no forbidden vendor module leakage",
    "pnpm.cmd --filter @grafting/architecture-studio check passed",
    "pnpm.cmd --filter @grafting/architecture-studio test passed: 8 application composition and presentation tests",
    "pnpm.cmd --filter @grafting/architecture-studio build passed: 1,187.09 kB raw / 354.30 kB gzip JavaScript, 3.90 kB Worker, and 196.01 kB Wasm",
    "source inspection confirmed x6-canvas remains presentation-neutral while Architecture Studio composes mountEntitySummary and @grafting/ui privately implements it with an Ant Design Card",
    "HTTP probe returned 200 for http://127.0.0.1:4511/",
    "pnpm.cmd graph:generate produced the current 45-node/42-edge coordination Graph IR candidate; graph:extract validated the current 49-node/48-edge real Graph IR; graph:manifest regenerated derived hashes",
    "pnpm.cmd docs:check passed for repo map, artifact manifest, real Graph IR, Rust public API, and x6-canvas public API",
    ".venv\\Scripts\\python.exe coordination validation passed for 28 task records after completion",
    ".venv\\Scripts\\python.exe control-plane audit passed with current graph candidate, zero model calls, and zero side effects",
    "git diff --check passed after completion"
  ],
  "artifacts": [
    "packages/x6-canvas/src/index.ts",
    "packages/x6-canvas/src/canvas/interaction-options.ts",
    "packages/x6-canvas/tests/composition.test.mjs",
    "packages/x6-canvas/tests/snapshots/public-api.md",
    "apps/architecture-studio/src/canvas-composition.ts",
    "apps/architecture-studio/src/style.css",
    "docs/specs/architecture-studio-read-only-v1.md"
  ],
  "risks": [
    "Moved coordinates are deliberately local to the private canvas instance and are neither persisted nor written back to Graph IR or the Rust layout snapshot.",
    "The concurrent Claude task UI-002 owns packages/ui and pnpm-lock.yaml, so this task must consume the existing EntitySummary Card without editing that scope.",
    "Visual drag acceptance remains manual because the in-app browser runtime exposed no browser backend in this session, although the local server returned HTTP 200.",
    "The existing Ant Design/Vite bundle remains above the provisional gzip guardrail and emits upstream use-client and chunk-size warnings; this task does not expand that dependency surface."
  ],
  "next_responsible_party": "repository-owner"
}
