{
  "schema_version": 1,
  "task_id": "UI-004-CARD-NODE-TAGS",
  "title": "Compose the Card atom's room for more content into Architecture Studio's node view via Graph IR tags",
  "status": "completed",
  "owner": "claude",
  "revision": 2,
  "updated_at": "2026-07-29T21:15:00-03:00",
  "objective": "The owner asked to put the new Card atom to work in Architecture Studio so each node card holds more than one element. EntitySummary already composes Card privately; this task adds a tags row (existing, real Graph IR node.tags data, not invented content) rendered as compact badges inside the card, and plumbs it end to end: GraphIrNode.tags -> CanvasNode.data -> EntitySummaryProps.tags -> rendered badges inside CardView. Architecture Studio's own source stays React-free; it only supplies plain data through mountEntitySummary, exactly like today.",
  "affected_paths": [
    ".ai/state/tasks/UI-004-CARD-NODE-TAGS.json",
    "packages/ui/src/index.ts",
    "packages/ui/src/molecules/entity-summary.tsx",
    "packages/ui/tests/ui.test.mjs",
    "packages/ui/tests/snapshots/public-api.md",
    "apps/architecture-studio/src/canvas-views.ts",
    "apps/architecture-studio/src/canvas-composition.ts",
    "apps/architecture-studio/src/presentation.ts",
    "apps/architecture-studio/test/presentation.test.mjs",
    "docs/generated/grafting.graph.json"
  ],
  "blockers": [],
  "validations": [
    "pnpm --filter @grafting/ui check/build/test: 9/9 passed, including a new test proving tags render and are capped at 3",
    "UPDATE_SNAPSHOTS=yes pnpm --filter @grafting/ui api-check: intentional baseline update reviewed (EntitySummaryProps.tags added)",
    "pnpm --filter @grafting/ui api-check (normal): passed, no forbidden vendor module leaked",
    "pnpm --filter @grafting/architecture-studio check: passed",
    "pnpm --filter @grafting/architecture-studio test: 8/8 passed, including the updated presentation contract asserting node.tags flows into CanvasNode.data.tags",
    "pnpm --filter @grafting/architecture-studio build: passed, 2628 modules, JS 1,102.74 kB raw / 328.79 kB gzip, 196.01 kB Wasm, 3.90 kB Worker (pre-existing upstream antd 'use client' bundler warnings unrelated to this change)",
    "pnpm run graph:extract + pnpm run docs:check: repo map, artifact manifest, Graph IR, Rust API, and x6-canvas API all passed",
    "pnpm audit --prod: no known vulnerabilities found",
    "pnpm run ai:check: coordination validation passed with 30 task records",
    "git diff --check on the full declared scope: passed (only a pre-existing LF/CRLF checkout warning)"
  ],
  "artifacts": [
    "packages/ui/src/index.ts",
    "packages/ui/src/molecules/entity-summary.tsx",
    "packages/ui/tests/ui.test.mjs",
    "packages/ui/tests/snapshots/public-api.md",
    "apps/architecture-studio/src/canvas-views.ts",
    "apps/architecture-studio/src/canvas-composition.ts",
    "apps/architecture-studio/src/presentation.ts",
    "apps/architecture-studio/test/presentation.test.mjs",
    "docs/generated/grafting.graph.json"
  ],
  "risks": [
    "The Architecture Studio node card has a fixed 288x84 size shared with the Rust layout request; a tag row is capped to a small number of tags and the card keeps overflow:hidden, so an entity with many tags is deliberately clipped rather than resized. Resizing the node to fit unbounded tag counts is a separate, larger change (Rust layout options too) and is out of scope here.",
    "No in-app browser backend is available in this session (the same limitation every prior Architecture Studio visual task recorded), so the actual rendered tag row cannot be visually confirmed here; only server-rendered (SSR) structural contracts and a production build are verified.",
    "This task does not touch packages/x6-canvas; the generic canvas contracts (CanvasNode.data is already opaque `unknown`) do not need to change for the application to add a new field to its own product-owned node data shape.",
    "Per DEC-053/ADR-0015, this task will prepare uncommitted changes only; the repository owner must review and create the actual Git commit."
  ],
  "next_responsible_party": "claude"
}
